source,url,paragraph,paragraph_num
Catholicnewsagency.com,https://www.catholicnewsagency.com/news/261659/what-would-happen-if-the-department-of-education-closed-under-trump,"Reestablished under President Jimmy Carter in 1978 to collect data, the Department of Education now manages funding for various programs for elementary and secondary students as well as federal studen...",4
Richmond.com,https://richmond.com/news/nation-world/education/higher-education-college-student-loan-debt-financial-aid/article_00061eaf-5c4b-5488-a56c-6356ff5263c0.html,- Acceptance rate: 45%,387
CNET,https://www.cnet.com/personal-finance/loans/the-2025-26-fafsa-is-open-experts-say-not-to-wait-to-apply-for-financial-aid-for-school/,"Before you hit submit, review everything to ensure all your answers are correct. Errors could result in delays, which could impact your financial aid awards. ",31
LADbible,https://www.ladbible.com/news/uk-news/martin-lewis-student-loans-2025-change-155697-20241231,Loads of people have recently been claiming money back due to having overpaid on their repayments.,9
BusinessLine,https://www.thehindubusinessline.com/markets/stock-market-highlights-1-february-2025/article69164334.ece, • Shipping Corp Ltd,652
Lifesciencesworld.com,https://lifesciencesworld.com/why-university-of-michigan/,Student Life,32
BusinessLine,https://www.thehindubusinessline.com/markets/stock-market-highlights-1-february-2025/article69164334.ece,Budget focused on creating disposable income and boost consumption,22
NerdWallet,https://www.nerdwallet.com/article/credit-cards/credit-card-data/2024-american-household-credit-card-debt-study#article,+3.77%,10
ABC News,https://abcnews.go.com/US/wireStory/colleges-us-cautiously-navigate-trumps-dei-crackdown-118337050,"The president of Mount Holyoke College, a liberal arts school in Massachusetts, said she hopes colleagues in higher education will not capitulate to Trump’s vision for the country. Danielle Holley sai...",3
Daily Signal,https://www.dailysignal.com/2025/01/31/higher-education-must-reform-else/,But you won’t find much wisdom in our modern-day institutions of higher learning. They appear to be constitutionally incapable of reforming from within and are arrogant enough to think they can remain...,28
