author,author_content_aggregated,cleaned,length
Ut_Prosim,"I don't see how a libertarian could argue against this in good faith.Wait -- of course, they could argue that this program should never have existed in the first place. They could also argue that it should be immediately phased out, and should not accept any new enrollees. But isn't ""contractarianism"" one of the pillars of the libertarian world view? I thought they were big on the idea that people should be bound by voluntary agreements made to reflect their personal interests (rather than being compelled by some external force)? Honoring voluntary contracts is the basis of all society. Once enrolled, the government and PSLF employees entered into such a contract. The employees promised to work in a specific field and region (as designated by the government) for 10 years and make 120 monthly payments under terms dictated by the government. If they did so, the government promised to discharge the remainder of their loans. The people in this story did just that, so they naturally expect the government to honor its side of the deal.Most of these folks made financial and life decisions based on this program. A lot of people took lower paying, crappier jobs, in areas where they didn't want to live, just to take advantage of this. They made a very detailed cost-benefit analyses comparing public service to industry, and this program is what tipped them towards the former. They sacrificed a lot, and took a large risk knowing that if the left a public service job before 10 years they'd lose 100% of their benefits, even if they worked for 99% of the term. The government also got a huge benefit, as it got to shift these professionals to regions and fields suffering shortages of workers.If these people had not enrolled, they could have refinanced with a private equity firm and gotten a lower APR. They could also have attacked their principal by making extra payments. In this program, the contract terms very explicitly required payments of 10-15% of income, no more, no less, all while the fixed interest (cannot be refinanced) accumulated. So if the government shafts them, they'll be far worse off than if the program had never existed in the first place.I don't see how you can call them freeloaders or entitled. If I promise a guy $50 to mow my yard and he does so, I can't then refuse to pay him and claim he's entitled for <surprised pikachu expecting a *handout* of $50. No, this is the case about SAVE. Biden introduced a friendlier repayment plan called SAVE that cuts monthly payments for a lot of people. The right challenged it for malicious reasons as expected, but the old plans under Obama and Trump weren't terrible. IIRC the original Bush era version required you to pay 15% of your income per month, and the Obama / Trump ones were down to 10%. The SAVE took undergrad loans down to 5%, and for grad loans allowed you to only count your own income instead of family income in the calculations (before, if you had a well paid spouse you were getting hosed as it took 10% of their income too). I think SAVE also had provisions where some [poor af] borrowers paid nothing. Public service loan forgiveness folks need to be in one of the income based repayment plans. If I understand correctly, this will force them to pick another (more expensive) plan, but it doesn't stop discharges when they reach their 10 years.",libertarian argue good faith wait course argue program existed place argue immediately phased accept new enrollee contractarianism pillar libertarian world view thought big idea people bound voluntary agreement reflect personal interest compelled external force honoring voluntary contract basis society enrolled government pslf employee entered contract employee promised work specific field region designated government year make monthly payment term dictated government did government promised discharge remainder loan people story did just naturally expect government honor deal folk financial life decision based program lot people took lower paying crappier job area did want live just advantage detailed cost benefit analysis comparing public service industry program tipped sacrificed lot took large risk knowing left public service job year lose benefit worked term government got huge benefit got shift professional region field suffering shortage worker people enrolled refinanced private equity firm gotten lower apr attacked principal making extra payment program contract term explicitly required payment income fixed refinanced accumulated government shaft far worse program existed place freeloader entitled promise guy mow yard doe ca refuse pay claim entitled surprised pikachu expecting handout case save biden introduced friendlier repayment plan called save cut monthly payment lot people right challenged malicious reason expected old plan obama trump terrible iirc original bush era version required pay income month obama trump one save took undergrad loan grad loan allowed count income instead family income calculation paid spouse getting hosed took income think save provision poor af borrower paid public service loan forgiveness folk need income based repayment plan understand correctly force pick expensive plan doe stop discharge reach year,261
arinehim,"I'm at 19K, I was literally done paying the loans off and got screwed over by the Republicans challenging the student loan forgiveness in court. Now it looks like when they implement it using the second method I won't be eligible for forgiveness. I'm really frustrated by it because my wife and I were looking at starting a family and this basically sets me back 2.5 years of grinding out payments. It was so frustrating because I was literally down to a principal balance of $500. I foolishly didn't park l that money into a High Yield Saving account to wait out the litigation. I don't have an exact number in front of me. I want to say it was around the 60k. I've been paying for years. If you exclude the pandemic and the pause I would have paid them off early. What frustrates me is there are thousands of REPUBLICANS in Congress who had their PPP loans whole sale forgiven. So they are all in favor of loan forgiveness, just not for a group other than themselves. I feel the same way. It's so funny to me they republican party complains that it can't get young people to vote for them. Maybe don't screw over millions of young working-class people. I actually gave props to Trump to pausing student loan payments and forgiving loans for veterans. If the rationale was good enough for Trump, why did Republicans suddenly have a change of heart when Biden used the same exact rationale? Sure it was political, that's the whole point of policy to do things your voters want. But if you take steps to strip a benefit away from a group of people whether it's Republicans or Democrats, dont come to me with crocodile tears when said group says they aren't going vote for Republicans again. I'm sure there a lot of folks on this subreddit who feel the same way I do.Bottom line, I would be debt free right now, starting a family without student loan debt, for others it might be purchasing a car, buying a house, maybe even starting their own business, but because of the REPUBLICANS I'm not, because I'm back in debt. Why do I blame Republicans? It's because if they had not brought the lawsuits I would literally be debt free right now. The individuals who encourage millennials to take out debt to get education were our parents and teachers who were both Republicans and Democrats. Bottom line is there's a direct line between a benefit my family would have received and that benefit being taken away and the political party that orchestrated it was the Republicans. They will never get my vote they rest of my life. Look I did pay them off, all the hard work you talked about, I did that. Used my bonuses, paid extra on them etc. I was literally down the last $500 of principal and I was eligable for the loan forgiveness. So I requested a refund on the funds I had paid during the pandemic (I continued paying never stopped). My mistake was not sticking the funds in a high yield checking account (my one and only mistake in this process). Then the forgiveness got struck down. Don't come at me with Bullshit about how I didn't pay, I did and I got screwed over by a political party hell bent on keeping young people down. Here here They took direct action that led to a negative impact for millions of Americans. This stuff isn't rocket science. If you hurt the pocketbooks/financial situation of a group of people don't expect them to vote for your party. Same thing happened with Abortion. You struck down Roe, which was a right women enjoyed for decades and now they find that right taken away from them (depending on where you live). Don't be shocked and surprised when they are motivated and vote against you. No I know that the Dems are not perfect angels. They are appalling in a number of ways I could easily list off for you. The bottom line is right now the republican action is having a direct negative impact to my families well-being/financial situation so they aren't getting my vote. Sorry from my perspective it's the Republicans fault full stop. There is literally nothing you can tell me to change my mind. I'm all for reforming the system but the republican policy on that front isn't any better.",literally paying loan got screwed republican challenging student loan forgiveness court look like implement using second method wo eligible forgiveness really frustrated wife looking starting family basically set year grinding payment frustrating literally principal balance foolishly did park money high yield saving account wait litigation exact number want say paying year exclude pandemic pause paid early frustrates thousand republican congress ppp loan sale forgiven favor loan forgiveness just group feel way funny republican party complains ca young people vote maybe screw million young working class people actually gave prop trump pausing student loan payment forgiving loan veteran rationale good trump did republican suddenly change heart biden used exact rationale sure political point policy thing voter want step strip benefit away group people republican democrat dont come crocodile tear said group say going vote republican sure lot folk subreddit feel way line debt free right starting family student loan debt purchasing car buying house maybe starting business republican debt blame republican brought lawsuit literally debt free right individual encourage millennials debt education parent teacher republican democrat line direct line benefit family received benefit taken away political party orchestrated republican vote rest life look did pay hard work talked did used bonus paid extra literally principal eligable loan forgiveness requested refund fund paid pandemic continued paying stopped mistake sticking fund high yield checking account mistake process forgiveness got struck come bullshit did pay did got screwed political party hell bent keeping young people took direct action led negative impact million american stuff rocket science hurt pocketbook financial situation group people expect vote party thing happened abortion struck roe right woman enjoyed decade right taken away depending live shocked surprised motivated vote know dems perfect angel appalling number way easily list line right republican action having direct negative impact family financial situation getting vote sorry perspective republican fault stop literally tell change mind reforming republican policy better,314
baby-luvs-gorgonzola,"I'm not sure whether to throw in the towel and hurl my (very small) life's savings at my balance, or to maintain patience and wait for potential forgiveness. Been paying my undergrad + grad loans since 1998. Hoped to qualify for forgiveness based on number of years in repayment, but no one on either the lender side or student aid dot gov side knows anything or has much info at all. The answer varies by the person I talk to, time of day, etcUPDATE DEC 2024: I made my periodic call to both student aid dot gov and my servicer (Nelnet) asking/begging for them to provide me my count of loan payments made since I started in 1999. Nelnet said that's student aid's job, and they are only one servicer I've had over the years, so they just don't have the number. Student aid said Nelnet should have that number for sure. I said they told me they don't have it. Their only advice was for me to ""file a complaint"" against Nelnet. I have negative, sub-zero % confidence that anyone knows that they are talking about at this point, or that I will ever procure this count, which I was originally told would be provided to me within 90 days (back in April). I feel your pain. I applied for the IDR plan in April 2024 in order to become eligible for student loan forgiveness based on number of years in repayment. And I've yet to be officially ""approved"" for IDR, even though signing up messed with my payments and I'm now paying several hundred more dollars per month under it. When I ask my lender or student aid dot gov when I'll be officially approved under the plan, and thus hopefully eligible for forgiveness, they have no idea. Yet I'm paying as if I have been approved for the plan. I'm sorry it happened to you too. I'm paying $400 more a month. The most frustrating part is that literally no one knows anything. I've been passed back and forth between studentaid and my lender and neither can even confirm how many qualifying payments I have. Or tell me when they'll know how many qualifying payments I have. Or really even tell me what exactly would make a payment ""qualifying"", because why not just count the months I've been in repayment??I feel as if I've (we've) been given a bait and switch. I am potentially qualified for forgiveness based on qualifying number of payments. However neither studentaid.gov nor my lender can provide further detail on if or when that may happen. They also cannot provide further info on the number of qualifying payments I have. Please share where you got this info. I've not been able to get any info out of either studentaid or my lender. As I understand it there is data on the positive impact student loan forgiveness would have on the economy. Hundreds of thousands of people in a financial chokehold would be freed up to buy homes, cars, etc., thus boosting the economy. A rising tide lifts all boats. In my case I'm not referring to blanket forgiveness but forgiveness based on months of qualifying payments. I signed up for IDR - which upped my monthly payment - under the pretense that the fact that I've been paying since 1998 would make me eligible for forgiveness. After I signed up and took that hit, no one knows anything. I applied for it in April 2024. The official status is still listed as ""under review"" on studentaid, however my monthly payment is higher, as if I've been approved. Previous to this I had consolidated undergrad and grad under a lender offer over a decade ago. I was told I needed to do IDR in order to qualify for loan forgiveness based on number of years in payment, so I did. Since May 2024. I was told signing up for IDR and switching my loans from consolidated back to govt would make me eligible for potential forgiveness based on years of repayment. I was told this by both studentaid and my lender. Did they lie?Also, while I've been signed up for IDR since April 2024 and paying on IDR since May 2024 my official status for IDR is still listed on my studentaid dashboard as ""pending review."" So your guess is as good as mine. It's a cluster. I'm not even sure they had income-based plans back in the 90s. Well then I was lied to. Or my enrollment in IDR was necessitated by re-enrolling in a federal plan after having consolidated with a lender decades ago. In either scenario I was most definitely told I needed to enroll in an IDR plan in order to be eligible for the look-back and further consideration for forgiveness based on time in repayment.In any case, maybe none of that matters since literally no one I've talked to at either studentgov or my lender is able to tell me 1) how many qualifying payments I have, 2) when my case might be looked at and/or evaluated for forgiveness based on my number of qualifying payments, 3) anything - they know nothing and the story changes each time I call.I am going on 7 months of calling and asking these same questions, after doing what they asked of me (flipping my loans back to fed + enrolling in an IDR plan). I feel like I've been taken for a ride, since my payments are now $400 more per month. Thank you! I hope it works out for everyone. The money I'm referring to is my emergency fund and some other basic savings. And that would cover about 30%. Save for a 401 and IRA, that's all I have. I find it helps to have empathy. People have extenuating circumstances - health issues, generational poverty, and layoffs to name but a few. Also these are not normal loans, they've been proven to be predatory and we essentially sign our financial future away when we are 18 or 19 years old and our frontal lobe isn't even fully developed, in order to try and get an education and contribute to society.Like I always say, if they had pulled this type of predatory and unethical shit with boomers' mortgages we'd have seen them rioting in the streets. I signed up for IDR based on the pretense that I would be eligible for forgiveness based on # of months of qualifying payments. Now no one can provide me with further details on that. Same. Did undergrad from 1994-1998. Been paying student loans since late 1998. Forgiveness based on # of months in repayment / # of qualifying payments (in my case). Wondered if others were feeling equally hopeless about their cases. But the govt regularly takes on huge debts in furtherance of economic growth - PPP loans, industry bailouts, etc Unfortunately I have never been eligible for this I adjusted my payment plan, increased my payments, and signed my name to this, on a false premise. I think there is a word for this. The student loan industry has been rampant with fraud, misinformation, miscalculations, miscommunication, and outright lies. If this were happening in the mortgage industry people like you would be storming the Capitol.Also, I'm sorry it so deeply triggers you that some people want to follow their dream of becoming teachers, doctors, engineers, social workers and other things that society could easily do without.",sure throw towel hurl small life saving balance maintain patience wait potential forgiveness paying undergrad grad loan hoped qualify forgiveness based number year repayment lender student aid dot gov know info answer varies person talk time day etcupdate dec periodic student aid dot gov servicer nelnet asking begging provide count loan payment started nelnet said student aid job servicer year just number student aid said nelnet number sure said told advice file complaint nelnet negative sub zero confidence know talking point procure count originally told provided day april feel pain applied idr plan april order eligible student loan forgiveness based number year repayment officially approved idr signing messed payment paying dollar month ask lender student aid dot gov officially approved plan hopefully eligible forgiveness idea paying approved plan sorry happened paying month frustrating literally know passed forth studentaid lender confirm qualifying payment tell know qualifying payment really tell exactly make payment qualifying just count month repayment feel given bait switch potentially qualified forgiveness based qualifying number payment studentaid gov lender provide happen provide info number qualifying payment share got info able info studentaid lender understand data positive impact student loan forgiveness economy hundred thousand people financial chokehold freed buy home car boosting economy rising tide lift boat case referring blanket forgiveness forgiveness based month qualifying payment signed idr upped monthly payment pretense fact paying make eligible forgiveness signed took hit know applied april official status listed review studentaid monthly payment higher approved previous consolidated undergrad grad lender offer decade ago told needed idr order qualify loan forgiveness based number year payment did told signing idr switching loan consolidated govt make eligible potential forgiveness based year repayment told studentaid lender did lie signed idr april paying idr official status idr listed studentaid dashboard pending review guess good cluster sure income based plan lied enrollment idr necessitated enrolling federal plan having consolidated lender decade ago scenario definitely told needed enroll idr plan order eligible look consideration forgiveness based time repayment case maybe matter literally talked studentgov lender able tell qualifying payment case looked evaluated forgiveness based number qualifying payment know story change time going month calling asking question doing asked flipping loan fed enrolling idr plan feel like taken ride payment month thank hope work money referring emergency fund basic saving cover save ira help empathy people extenuating circumstance health issue generational poverty layoff normal loan proven predatory essentially sign financial future away year old frontal lobe fully developed order try education contribute society like say pulled type predatory unethical shit boomer mortgage seen rioting street signed idr based pretense eligible forgiveness based month qualifying payment provide detail did undergrad paying student loan late forgiveness based month repayment qualifying payment case wondered feeling equally hopeless case govt regularly take huge debt furtherance economic growth ppp loan industry bailouts unfortunately eligible adjusted payment plan increased payment signed false premise think word student loan industry rampant fraud misinformation miscalculation miscommunication outright lie happening mortgage industry people like storming capitol sorry deeply trigger people want follow dream teacher doctor engineer social worker thing society easily,510
