author,author_content_aggregated,cleaned,length
milespoints,"I think you would benefit more from some context. The current ""problem"" with student loans from a public policy perspective is that the federal govt has, for too long, written a blank check to universities by being willing to lend ""whatever the schooling costs"". This has resulted in amounts borrowed and, as a result, student loan balances skyrocketing. Everyone agrees on this, republicans and democrats alike. The democratic solution has been to try to decrease monthly loan payments and diverge total amount paid from total amount borrowed. Basically, with SAVE and the like, it matters less and less how much you borrow, as you just make (very affordable) income based repayments and eventually the remaining balance just gets forgiven. This would probably result in an ever increasing subsidy in the form of forgiveness (schools could keep charging more and more, and there is no real cost control or limit). Note that there a lot of things going for this policy, but it does introduce a type of moral hazard. You can keep borrowing more and more, and since it all gets forgiven (and most people do not pay taxes on the amount forgiven) you don't really pay anything extra.The republican solution is to go completely the other direction. Republicans do not like open-ended government subsidies. Republicans want to make loans MORE burdensome, not less, in order to incentivize people to borrow less and to incentivize schools to charge less. This proposal achieves this by keeping the payments affordable but getting rid of that 20-25 year forgiveness get out of jail free card. To me there is an intuitive fairness to say ""Everyone pays back the amount they borrowed and the interest they signed up for"". Fair is square. You borrowed the money. It also caps loan amounts to prevent universities from continuing to jack up tuition. So is this good policy? God no. If this entire thing has taught us much is that your average 18 year old is, financially speaking, noy very sharp. Most 18 year olds do not ""respond to financial incentives"" like that. They will continue to borrow as much as they need to graduate from their school of choice, and then just make payments forever, until they die. Even worse, because this plan caps loan amounts, it would make people go borrow from private lenders, where there is no IDR. While there is some sort of inherent cost control included here (private lenders probably won't lend you $500k for your gender studies PhD or whatever, they wanna get repaid), it's not gonna do much (there is still a lot of room for americans to pay more for loans)But if you think, like most republicans, that the problem with student loan policy is that the government has subsidies that are just too generous, this bill fixes that. You can't really allow student loan debt to be discharged like that. Most young graduates have no assets. So it would quickly become standard process to just file chapter 7 immediately after college graduation (no assets to lose anyway, and very few people need clean credit to buy a house or the like at age 24). Then start rebuilding credit, and be in tip top shape to get any loan you might want when the BK falls off in 7 years, which would be like age 28 I mean, i am not a big fan of this bill for all the reasons mentioned, but those two shouldn't be mutually exclusive. You can have both accessible and cost-effective education! My own opinion is that the GOP plan would be decent with one modification - if it would require universities to accept the capped federal student loan disbursement as payment in full for tuition and fees. In other words, you either take federal loans or not. If you do, you can't ""balance bill"" the student. This is how federal NSF fellowships for PhD students work Why do you think that? Tbh we can bring back the entire cost control that we used to have by just including a provision in the loan terms that the school must accept the federal loan disbursement as payment in full My guess is that republicans don't wanna do that because it would decimate the private student loan industry I mean, the current 20-25 year IDR forgiveness is essentially that, just with a longer timeline. Again, the point is that you don't want to incentivize people to strategically declare bankruptcy to shed their student loans. Being able to do that at even 10 years after graduation would probably result in tons of people going that route Yes. And people were abusing it, which is why we got rid of that. Did you actually read your MPN?I am pretty sure it's very specifically laid out there in what circumstances the interest can capitalize",think benefit context current problem student loan public policy perspective federal govt long written blank check university willing lend schooling cost resulted amount borrowed result student loan balance skyrocketing agrees republican democrat alike democratic solution try decrease monthly loan payment diverge total paid total borrowed basically save like matter borrow just make affordable income based repayment eventually remaining balance just get forgiven probably result increasing subsidy form forgiveness school charging real cost control limit note lot thing going policy doe introduce type moral hazard borrowing get forgiven people pay tax forgiven really pay extra republican solution completely direction republican like open ended government subsidy republican want make loan burdensome order incentivize people borrow incentivize school charge proposal achieves keeping payment affordable getting rid year forgiveness jail free card intuitive fairness say pay borrowed signed fair square borrowed money cap loan amount prevent university continuing jack tuition good policy god entire thing taught average year old financially speaking noy sharp year old respond financial incentive like continue borrow need graduate school choice just make payment forever die worse plan cap loan amount make people borrow private lender idr sort inherent cost control included private lender probably wo lend gender study phd wan na repaid gon na lot room american pay loan think like republican problem student loan policy government subsidy just generous fix ca really allow student loan debt discharged like young graduate asset quickly standard process just file chapter immediately college graduation asset lose people need clean credit buy house like age start rebuilding credit tip shape loan want bk fall year like age mean big fan reason mentioned mutually exclusive accessible cost effective education opinion gop plan decent modification require university accept capped federal student loan disbursement payment tuition fee word federal loan ca balance student federal nsf fellowship phd student work think tbh bring entire cost control used just including provision loan term school accept federal loan disbursement payment guess republican wan na decimate private student loan industry mean current year idr forgiveness essentially just longer timeline point want incentivize people strategically declare bankruptcy shed student loan able year graduation probably result ton people going route yes people abusing got rid did actually read mpn pretty sure specifically laid circumstance capitalize,373
mindmapsofficial,"Did some quick calculations and this really doesn't confer a real substantial benefit to any group compared to existing* IDR plans.Basically it makes those in the lower income brackets with high debt will never pay off their loans. High income, low debt people never benefitted off IDR plans in the first place.Mid income, mid debt people are the only group that get a benefit sometimes, but its marginal. Some quick calculations: legislation seems to be more deterrence to borrowing so people don't engage in the moral hazard of over borrowing. However, if you ask most people, they don't take out 300k+ in loans with a plan to make $30k per year. Sometimes life just happens and doesn't go as planned.For example, someone with 10k in debt and an income of $30k would be paying for 18 years. Someone making 100k with 140k of debt would be paying for 25.2 years. Also, if you have kids, it's not more forgiving, unlike existing* IDR plans. Your payment is lower, but you just have to make it up with more overall payments. Similarly, 401k and HSA contributions don't confer a benefit since your reduced payments need to be made up later in life. I added existing* to clarify The salary is adjustable. Feel free to edit the spreadsheet after making a copy. I understand that it's more forgiving than having only the standard plan, buts it's actually less forgiving than existing IDR plans I literally have been giving student loan advice on the internet for about a year and a half. I couldn't even communicate this information to my 18 year old brother in a manner sufficient to get him to change his mind. Social pressure to go to college and certain colleges can outweigh being rational, especially in teenagers. You can argue that they were of legal age and signed a contract. However, most underwriters for other loans would never enter into that contract with them. The real solution is finding a way to bring the costs of education down. Well, there are infinitely possible forms of the same plan that would be equally fair, yet they chose this one. They could've done 5% of your discretionary income or 15% of one's discretionary income. They could've used a 5-year amortization period as the standard for these purposes. Why did they choose this variation of ""fair"" It's uncommon to not grandfather something in. Everything can be legally changed, including the constitution so it's a matter of probability rather than possibility. It's unlikely they take you off current plans but not impossible Your wages are garnished, which is at a higher income percent than IDR plans with no discretionary income reduction Education and training is different. Most jobs don't really require heavy education. I would say that K-12 education is sufficient for 80+% of people. This is generally funded through property taxes. I have a law degree and practice law. Little would have changed in my practice if I went straight to my job after the first year of law school. Jobs use education and grades as a way to find the ""good employees."" Grades and scores are one of the few ""hard signals"" that employers can rely upon, so they do just that. Training on the other hand is generally footed by employers. Most difficult jobs, your employment is at a loss the first few months since it's inefficient and likely prone to errors. Additionally, the person training you has to do their job plus train you. Because dems made it an issue, and republicans responded by opposing the dem's attempt to address that issue Also implemented SAVE Because SAVE had a 225% poverty guideline multiplier and a 100% interest subsidy, compared to 150% multiplier and a 50% subsidy under REPAYE. SAVE is much more generous than other plans for low income borrowers.SAVE was enacted similarly to PAYE and REPAYE so when the litigation of SAVE was enacted, PAYE and REPAYE came under threat since they were passed under the same process. Agreed. Otherwise, we either have (i) runaway student loan debt or (ii) lack of access. This shifts treasury payments from the wealthy to the working class (regressive) so it does confer some benefit to the hyper wealthy from a tax perspective For federal taxation, there's an insolvency exception, as described in my post that I also recently responded to your comment. Additionally, student loan forgiveness is exempt at the federal level from taxation until the end of 2025. After which, congress can decide to extend the exemption or let it lapse.Loan debt forgiveness, in general, has been taxable for a very long time so these laws aren't new by any means. 255k. No, it is a minor concern. I just pay my income based repayment and focus on investing and paying off my mortgage.It's literally my last priority since it can be reduced if my income decreases and the government can't foreclose on my degree.If you haven't maxed out your 401k for the year, it typically does not make sense to pay extra for federal student loans Debt to income ratio is based on monthly student loan payments not the total debt amount. If your monthly payment is $0, they use like 0.5% of your total balance as your monthly payment. So for $250k of loans, the lender calculated that my monthly payment is $1250 for their calculation of DTI. If your monthly payment is not $0, they just use their monthly payment amount to calculate DTI.Qualified for $650k mortgage with $250k income and $250k student loans",did quick calculation really doe confer real substantial benefit group compared existing idr plan basically make lower income bracket high debt pay loan high income low debt people benefitted idr plan place mid income mid debt people group benefit marginal quick calculation legislation deterrence borrowing people engage moral hazard borrowing ask people loan plan make year life just happens doe planned example debt income paying year making debt paying year kid forgiving unlike existing idr plan payment lower just make overall payment similarly hsa contribution confer benefit reduced payment need later life added existing clarify salary adjustable feel free edit spreadsheet making copy understand forgiving having standard plan buts actually forgiving existing idr plan literally giving student loan advice internet year half communicate information year old brother manner sufficient change mind social pressure college certain college outweigh rational especially teenager argue legal age signed contract underwriter loan enter contract real solution finding way bring cost education infinitely possible form plan equally fair chose discretionary income discretionary income used year amortization period standard purpose did choose variation fair uncommon grandfather legally changed including constitution matter probability possibility unlikely current plan impossible wage garnished higher income percent idr plan discretionary income reduction education training different job really require heavy education say education sufficient people generally funded property tax law degree practice law little changed practice went straight job year law school job use education grade way good employee grade score hard signal employer rely just training hand generally footed employer difficult job employment loss month inefficient likely prone error additionally person training job plus train dems issue republican responded opposing dem attempt address issue implemented save save poverty guideline multiplier subsidy compared multiplier subsidy repaye save generous plan low income borrower save enacted similarly paye repaye litigation save enacted paye repaye came threat passed process agreed runaway student loan debt ii lack access shift treasury payment wealthy working class regressive doe confer benefit hyper wealthy tax perspective federal taxation insolvency exception described post recently responded comment additionally student loan forgiveness exempt federal level taxation end congress decide extend exemption let lapse loan debt forgiveness general taxable long time law new mean minor concern just pay income based repayment focus investing paying mortgage literally priority reduced income decrease government ca foreclose degree maxed year typically doe make sense pay extra federal student loan debt income ratio based monthly student loan payment total debt monthly payment use like total balance monthly payment loan lender calculated monthly payment calculation dti monthly payment just use monthly payment calculate dti qualified mortgage income student loan,428
mlotto7,"My oldest daughter is 20 and just graduated with honors w/ a BS degree debt free.I am from poverty and have a BS and MA and did so debt free.My wife earned a BS and MS and did so debt free.My youngest daughter will earn an AA then go on to trade school - debt free.It's too easy for students to take out massive loans to float a work-free college experience where they eat and travel on loan money. It saddles them in debt for life and isn't necessary. Being from poverty, I am living proof higher education can be accomplished without debt if someone really tries. My family and I are alum from a lot of different schools:University of Oregon (Go Ducks!), Liberty, University of Utah (Go Utes!), University of the Southwest, University of Cumberlands, Arizona State University I'm from poverty and neither of my parents went to college. I knew if I wanted a shot at college (and needed my teeth desperately fixed) I had to join the military. At 18 I enlisted during wartime. Served honorably. Upon discharge I utilized my GI Bill and worked at Target from 12am-8am and attended class FT during the day. Yeah, I went without sleep sometimes but for me it was worth not having any debt. This is how I earned my undergrad. During graduate school I was a laboratory manager working 50 hours a week, married with two kids, took foster/adoption classes at night 2x a week to get state licensed as a foster parent so we could adopt, coached youth sports and never missed my daughter's soccer games and practices. Yeah...again...not much sleep but it sure beat going into debt or missing my family. I graduated with honors both under and grad school.My wife is from a well-off family and her parents paid her tuition but she was responsible for her insurance, gas, entertainment, books, fees. She had a partial scholarship as a cheerleader and paid her way by waitressing the same job for almost three years. She graduated at age 20 with honors - taking avg 18 credits and working.I wanted better for my kids so when they were born I invested $1000 into a 529 and also put $50 a month into them. My daughter did dual enrollment and graduated HS with her AA and stayed at home (no reason to live in dorms and pay $$). We used her fund for tuition. She will go on to a masters and she has enough in her fund to cover that too.My youngest wants to experience the dorm/college life and that's fine by me. We will help her financially and she has her college fund. She plans to just get an AA then go to trade school (court reporting). Living at home is the best scenario. I know that isn't healthy in some situations, but if a student can do it - it's best for the budget.Also, there are some amazing employers out there that offer tuition reimbursement for employees (even part time). Chipotle, Starbucks, and Amazon come to mind. I think I even saw Walmart. I was chatting with a young college student and employee of Chipotle a few weeks ago. She told me she loves her job, works part time, and gets about $5,500 in tuition support from the company. I believe (double-check) that Walmart employees get 100%. They are only for approved education programs - I believe anything from IT, healthcare, business, teaching - is included. Don't forget Pell Grant and to spend weeks (not a few hours) applying for any and all scholarships. Many of the smaller ones (say $500 a year) go unused because people aren't applying. I have a good friend who spent all summer just applying for scholarships of $500 or less and fully funded his degree. Good luck!",oldest daughter just graduated honor b degree debt free poverty b ma did debt free wife earned b m did debt free youngest daughter earn aa trade school debt free easy student massive loan float work free college experience eat travel loan money saddle debt life necessary poverty living proof higher education accomplished debt really try family alum lot different school university oregon duck liberty university utah ute university southwest university cumberland arizona state university poverty parent went college knew wanted shot college needed teeth desperately fixed join military enlisted wartime served honorably discharge utilized gi worked target attended class ft day yeah went sleep worth having debt earned undergrad graduate school laboratory manager working hour week married kid took foster adoption class night week state licensed foster parent adopt coached youth sport missed daughter soccer game practice yeah sleep sure beat going debt missing family graduated honor grad school wife family parent paid tuition responsible insurance gas entertainment book fee partial scholarship cheerleader paid way waitressing job year graduated age honor taking avg credit working wanted better kid born invested month daughter did dual enrollment graduated h aa stayed home reason live dorm pay used fund tuition master fund cover youngest want experience dorm college life fine help financially college fund plan just aa trade school court reporting living home best scenario know healthy situation student best budget amazing employer offer tuition reimbursement employee time chipotle starbucks amazon come mind think saw walmart chatting young college student employee chipotle week ago told love job work time get tuition support company believe double check walmart employee approved education program believe healthcare business teaching included forget pell grant spend week hour applying scholarship smaller one say year unused people applying good friend spent summer just applying scholarship fully funded degree good luck,301
