author,author_content_aggregated,cleaned,length
-CJF-,"PPP loans were passed by legislation and designed to be forgiven if used properly, but [Trump removed the oversight]( which was shady at best.It's important to remember the field of law is a creation. It was made by people and has no inherit truth. What is legal and what is not is subjective in many cases. Student loan forgiveness is one such case. Roe v Wade is another. See the Dobbs decision and compare that to the prior Roe v. Wade ruling. They're inconsistent and incompatible because the justices hearing the case had different ideologies and personal beliefs. Forgiveness? Yes. I do still have some hope for the SAVE plan, just because overturning it would be such a wild stretch of the law. This bill is terrible and if they do manage to pass it via reconciliation Democrats would surely undo it via reconciliation as soon as they retake the majority. Where is the Protecting Taxpayers from Wealthy Business Bailouts Act?By the way, if Biden's actions surrounding student loan forgiveness were illegal, why does Congress need to pass a bill forbidding it...? It's not just student loans.Republicans are against so many safety net programs...SNAP and Medicaid, broadband and communication benefits, the Affordable Care Act protections for healthcare, etc. As bad as it was to give Trump the presidency I'm surprised voters would give republicans full control of government. They are going to make all of our lives more difficult.On the plus side,I think people will have massive buyers remorse by the midterms. Unfortunately a lot of damage can be done in two years with no checks or balances. At this point I just hope the IDR adjustment hits before the new administration takes charge, otherwise I will lose years of payment history. Then after SAVE falls I will go back to IBR. If Trump did it, it would be funny to watch it suddenly become lawful. But alas, doing this would require motivation to help people, which unfortunately just isn't there. It's a nice thought. I hope you're right. I'm still waiting on the one-time account adjustment to hit. What are they waiting for? If this drags on into Trump administration I have zero confidence we will ever see it. Regardless of how anyone feels about student loan forgiveness, we should all at least be able to agree that restarting IDR payment counts from zero is completely and totally unfair. Sounds like concepts of a plan with no implementation. I'm seeing a pattern on the right. For what it's worth, I'm about as pessimistic about republican policy as possible and I don't think IBR is getting changed. I wouldn't worry about that. Trump's plan to deport 20 million migrants via executive orders is estimated to cost upwards of a trillion dollars. It will be interesting to see if it faces any lawsuits and how SCOTUS responds to that with their *Major Questions Doctrine* or if we'll just see blind partisan hypocrisy. There is only one IBR plan (Income-Based Repayment). You are likely referring to IDR (Income-Driven Repayment) which is terminology that comprises all of the plans based on income such as PAYE, REPAYE, SAVE, IBR, etc. I agree with your assessment that a Trump Department of Education will not process any IDR forgiveness.Even in the worst case I think IBR will survive in some form. Republicans had proposed changes to IBR that remove the forgiveness at the end but add an interest subsidy. However, it would have to pass Congress. I don't think that will happen. The more likely scenario is IBR stays as is, SAVE (and possibly PAYE, REPAYE and portions of ICR) all go down with the lawsuit and no forgiveness at all gets processed under Trump.Just my 2c. This article is wrong that the lower interest rate wouldn't help people on income-driven plans. Those plans still accumulate interest at whatever rate you borrowed at, even if you have a $0 per month payment, so it would help.I think democrats would be on board with this if it's a clean bill with nothing else in it but I'm not sure how many Republicans would support it. More than likely, or it just won't have enough support from other Republicans and will flop. I hope I'm wrong. I agree with that and more, but with Republicans in charge we would be really lucky to get anything and 1% would definitely help a lot.",ppp loan passed legislation designed forgiven used properly trump removed oversight shady best important remember field law creation people inherit truth legal subjective case student loan forgiveness case roe wade dobbs decision compare prior roe wade ruling inconsistent incompatible justice hearing case different ideology personal belief forgiveness yes hope save plan just overturning wild stretch law terrible manage pas reconciliation democrat surely undo reconciliation soon retake majority protecting taxpayer wealthy business bailouts act way biden action surrounding student loan forgiveness illegal doe congress need pas forbidding just student loan republican safety net program snap medicaid broadband communication benefit affordable care act protection healthcare bad trump presidency surprised voter republican control government going make life difficult plus think people massive buyer remorse midterm unfortunately lot damage year check balance point just hope idr adjustment hit new administration take charge lose year payment history save fall ibr trump did funny watch suddenly lawful ala doing require motivation help people unfortunately just nice thought hope right waiting time account adjustment hit waiting drag trump administration zero confidence regardless feel student loan forgiveness able agree restarting idr payment count zero completely totally unfair sound like concept plan implementation seeing pattern right worth pessimistic republican policy possible think ibr getting changed worry trump plan deport million migrant executive order estimated cost upwards trillion dollar interesting face lawsuit scotus responds major question doctrine just blind partisan hypocrisy ibr plan income based repayment likely referring idr income driven repayment terminology comprises plan based income paye repaye save ibr agree assessment trump department education process idr forgiveness worst case think ibr survive form republican proposed change ibr remove forgiveness end add subsidy pas congress think happen likely scenario ibr stay save possibly paye repaye portion icr lawsuit forgiveness get processed trump just article wrong lower rate help people income driven plan plan accumulate rate borrowed month payment help think democrat board clean sure republican support likely just wo support republican flop hope wrong agree republican charge really lucky definitely help lot,333
42Pockets,"Absolutely! Education is the backbone of the First Amendment.Excellent!!! Keep it going!The purposes of Government set forth in [The U.S. Constitution: Preamble]( the People of the United States, in Order to form a more perfect Union, establish Justice, insure domestic Tranquility, provide for the common defense, *promote the general Welfare*, and secure the Blessings of Liberty to ourselves and our Posterity, do ordain and establish this Constitution for the United States of America.""These are the guidelines to decide should ""We the People"" do this?Alexander Hamilton even wrote in [Federalist Papers: 84]( about the importance of the Preamble.Here is a better recognition of popular rights, than volumes of those aphorisms which make the principal figure in several of our State bills of rightsOut of these purposes of government, Promote the General Welfare, Education for All is square in the sights of this idea. John Adams [wrote]( a bit about the importance of education in a democracy.the social science will never be much improved untill the People unanimously know and Consider themselvs as the fountain of Power and untill they Shall know how to manage it Wisely and honestly. reformation must begin with the Body of the People which can be done only, to affect, in their Educations. **the Whole People must take upon themselvs the Education of the Whole People and must be willing to bear the expences of it.** there should not be a district of one Mile Square without a school in it, *not founded by a Charitable individual but maintained at the expence of the People themselvs they must be taught to reverence themselvs instead of adoreing their servants their Generals Admirals Bishops and Statesmen**Here he makes clear the importance of the People being an integral part of the system. It gives us ownership of our own destiny together. He emphasizes the idea of the Whole People and Whole Education. This would include anything preschool and anything after high school, not necessarily just college, but also trade schools, etc.The rest of the letter John Adams wrote to John Jeb is absolutely fantastic. He goes on to discuss why it's important to create a system that makes people like Martin Luther King jr, Susan B Anthony, Carl Sagan, and Mr Rogers, and Washington. Good leaders should not be a product of the time, but of the educational system and culture of the people. If a country doesn't make good leaders then when that leader is gone there's no one to replace them and that culture and movement dies with them.Instead of Adoring a Washington, Mankind Should applaud the Nation which Educated him. If Thebes owes its Liberty and Glory to Epaminondas, She will loose both when he dies, and it would have been as well if She had never enjoyed a taste of either: but if the Knowledge the Principles the Virtues and Capacities of the Theban Nation produced an Epaminondas, her Liberties and Glory will remain when he is no more: and if an analogous system of Education is Established and Enjoyed by the Whole Nation, it will produce a succession of Epaminandas's.In another short work by John Adams, [Thoughts on Government]( [YouTube Reading]( he wrote about the importance of a liberal education for everyone, spared no expense.Laws for the liberal education of youth, especially of the lower class of people, are so extremely wise and useful, that, to a humane and generous mind, no expense for this purpose would be thought extravagant.100 years ago we built in mass the first major wave of highschools in the United States.[In]( 1910 18% of 15- to 18-year-olds were enrolled in a high school; barely 9% of all American 18-year-olds graduated. By 1940, 73% of American youths were enrolled in high school and the median American youth had a high school diploma.This was a dramatic shift in education and economic gain for the United States. Not all of our grandparents went to highschool until the public saw it necessary to build them. The future is going to need more local experts than ever and a high school education that was good 100 years ago just isn't going to cut it on a global scale. People will need to change careers in the future and probably more than once. We will need continuing education as a society so that people can adapt and change with the coming times. This includes ensuring that after graduating high school people are able to attend and easily afford the education they need to participate in their community.As long as a person puts in their work to learn and change themselves, our citizens shouldn't be overly burdened with expenses for attending a public education program.It's not that citizens shouldn't pay anything, but it shouldn't be so much as to keep them from working and meaningfully participating in the economy. Not as indentured servants, but free citizens.",absolutely education backbone amendment excellent going purpose government set forth constitution preamble people united state order form perfect union establish justice insure domestic tranquility provide common defense promote general welfare secure blessing liberty posterity ordain establish constitution united state america guideline decide people alexander hamilton wrote federalist paper importance preamble better recognition popular right volume aphorism make principal figure state bill rightsout purpose government promote general welfare education square sight idea john adam wrote bit importance education democracy social science improved untill people unanimously know consider themselvs fountain power untill shall know manage wisely honestly reformation begin body people affect education people themselvs education people willing bear expences district mile square school founded charitable individual maintained expence people themselvs taught reverence themselvs instead adoreing servant general admiral bishop statesman make clear importance people integral give ownership destiny emphasizes idea people education include preschool high school necessarily just college trade school rest letter john adam wrote john jeb absolutely fantastic go discus important create make people like martin luther king jr susan anthony carl sagan mr rogers washington good leader product time educational culture people country doe make good leader leader gone replace culture movement dy instead adoring washington mankind applaud nation educated thebe owes liberty glory epaminondas loose dy enjoyed taste knowledge principle virtue capacity theban nation produced epaminondas liberty glory remain analogous education established enjoyed nation produce succession epaminandas short work john adam thought government youtube reading wrote importance liberal education spared expense law liberal education youth especially lower class people extremely wise useful humane generous mind expense purpose thought extravagant year ago built mass major wave highschool united state year old enrolled high school barely american year old graduated american youth enrolled high school median american youth high school diploma dramatic shift education economic gain united state grandparent went highschool public saw necessary build future going need local expert high school education good year ago just going cut global scale people need change career future probably need continuing education society people adapt change coming time includes ensuring graduating high school people able attend easily afford education need participate community long person put work learn change citizen overly burdened expense attending public education program citizen pay working meaningfully participating economy indentured servant free citizen,375
AffectionatePause152,"""1% is too Socialist""- every Republican in office Student loans become due after graduation when most people make the least money they will make in their careers. As a result, people make minimum payments at the very beginning of their loan terms, and then they settle into a lifestyle where it becomes very difficult to increase their payments. Because most major corporations only give 3-4% raises per year, and due to the fact that the cost of living goes up 2-3% per year (or more), its not easy to allocate more cash toward paying off loans when someone gets a raise. This is a systemic issue that makes paying off large loans very challenging without a significantly large infusion of cash (marriage or a job change with a significant raise) or a significantly large reduction in lifestyle (moving in with parents or some other co-habitation).This causes the interest on the large balances to grow significantly, making the whole thing a rat race that is very hard to win in America. The solution is for taxes to provide free or low cost state education. It's not a pipe dream: this was the way it used to be in the 1960s. What we do instead now is force young students to self fund their education (federally, on interest) to enable older and current tax payers to pay a little less on their state taxes.I swear if Republicans could find a way to charge interest on Kindergarteners and bill them after high school, they would do it in a heartbeat if it saved them $100 a year. For every problem, there is a solution. Perhaps you can try to answer the questions yourself while being as creative as possible. That's one option. The underlying problem is that living costs are too high for college students. Loans just makes the problem worse because of interest. Perhaps the Feds can step in and instead of loans for every student (which have to be dished out again and again) just pay a single cost for a no-frills dorm building with very simple accommodations. Like 6 per room. But lots of shared space for actually working and studying (like libraries). Since costs are too high, there seems to be an imbalance somewhere where supply is not meeting demand and it's only being masked with the easy disbursement of loans. It's a very inefficient way of meeting the need when building actual structures to meet the needs would have a shared benefit that lasts longer. Food is food. We have lots of farms and subsidies going to farmers (big corporations) anyway. Perhaps we need to get the farmers to supply something for those subsidies they're getting. It's not fair. It doesn't have to be fair. We give all sorts of benefits to the military such as food, housing, etc. It's about meeting a national need at a reasonable cost, and that's it. We have to get this idea of fairness out of our minds. No tax or benefit on any group over any other has EVER been fair, but they are everywhere. It's only when we talk about helping students when all this hogwash about fairness creeps up. The point is that it's about priorities. We spend $40,000 on fuel per 3 hr training mission for our military pilots. How do I know? A pilot told me. Now, no one is saying that we don't need to train our pilots, but god damn that's a lot on money day after day. We surely have the means of creating shelter for student at a low cost. It's not that hard.",socialist republican office student loan graduation people make money make career result people make minimum payment beginning loan term settle lifestyle difficult increase payment major corporation raise year fact cost living go year easy allocate cash paying loan get raise systemic issue make paying large loan challenging significantly large infusion cash marriage job change significant raise significantly large reduction lifestyle moving parent habitation cause large balance grow significantly making thing rat race hard win america solution tax provide free low cost state education pipe dream way used instead force young student self fund education federally enable older current tax payer pay little state tax swear republican way charge kindergartener high school heartbeat saved year problem solution try answer question creative possible option underlying problem living cost high college student loan just make problem worse fed step instead loan student dished just pay single cost frill dorm building simple accommodation like room lot shared space actually working studying like library cost high imbalance supply meeting demand masked easy disbursement loan inefficient way meeting need building actual structure meet need shared benefit last longer food food lot farm subsidy going farmer big corporation need farmer supply subsidy getting fair doe fair sort benefit military food housing meeting national need reasonable cost idea fairness mind tax benefit group fair talk helping student hogwash fairness creep point priority spend fuel hr training mission military pilot know pilot told saying need train pilot god damn lot money day day surely mean creating shelter student low cost hard,252
